,FILE_NAME,JOB_CLASS_TITLE,JOB_CLASS_NO,REQUIREMENT_SET_ID,REQUIREMENT_SUBSET_ID,JOB_DUTIES,EDUCATION_YEARS,SCHOOL_TYPE,EDUCATION_MAJOR,EXPERIENCE_LENGTH,FULL_TIME_PART_TIME,EXP_JOB_CLASS_TITLE,EXP_JOB_CLASS_FUNCTION,COURSE_COUNT,COURSE_LENGHT,COURSE_SUBJECT,DRIVERS_LICENSE_REQ,DRIV_LIC_TYPE,EXAM_TYPE,ENTRY_SALARY_GEN,ENTRY_SALARY_DWP,OPEN_DATE
162,ENVIRONMENTAL SPECIALIST 7310 012916.txt,ENVIRONMENTAL SPECIALIST,7310,2,,"  An Environmental Specialist plans, performs, reviews, and analyzes environmental studies, reports, and proposals to determine their environmental and policy impacts on the City; conducts studies which may require collection and evaluation of field and laboratory data to determine the environmental impacts from the storage, handling, or release of solid waste and hazardous materials; conducts noise measurements to assess impacts and enforces noise abatement policies; conducts environmental compliance inspections and enforcement procedures as necessary; coordinates and implements environmental compliance, remediation and enhancement projects and programs; makes recommendations in accordance with established environmental policy and relevant technical information; oversees environmental consultant activities and services; reviews, analyzes and/or prepares California Environmental Quality Act (CEQA), National Environmental Policy Act (NEPA), and Safe Drinking Water Act (SDWA) documents, various environmental  permits, and grant applications; conducts outreach and education on environmental issues; works with other public agencies and the community, and may act as a technical team leader.",4,"university, college", ,4,full-time,,|one or more of the following activities:  environmental review and analysis; air quality| water quality| noise abatement| solid waste and recycling| toxic or hazardous material management; development of site characterization and site remediation plans; environmental legislative and regulatory review and development; conducting environmental regulatory inspections and/or environmental audits; environmental project management for the protection and enhancement of environmental resources; or environmental policy or planning., ,   ,,P, ,OPEN,73038,80408,2016-01-29
163,GALLERY ATTENDANT 2442 092515.txt,GALLERY ATTENDANT ,2442,0,,  A Gallery Attendant assists in the construction and installation of display units and in the operation and maintenance of an art gallery.,0,, ,5,,,|the operation and maintenance of an art gallery or museum| including the construction and maintenance of display units and protection of exhibits., ,   ,,P, ,OPEN,43284,-1,2015-09-25
164,PERSONNEL RECORDS SUPERVISOR 1129 041318.txt,PERSONNEL RECORDS SUPERVISOR,1129,0,,"  A Personnel Records Supervisor plans, organizes and directs the work of clerical employees and independently performs responsible and difficult clerical work involving the preparation, processing and maintenance of a wide variety of personnel forms, documents and records; develops and interprets personnel procedures; applies sound supervisory principles and techniques in building and maintaining an effective work force; and fulfills equal employment opportunity responsibilities.",0,, ,2,full-time,,|a class at the level of Senior Administrative Clerk., ,   ,,P, ,OPEN_INT_PROM,71012,-1,2018-04-13
165,ELECTRICAL ENGINEERING DRAFTING TECHNICIAN 7532 113018.txt,ELECTRICAL ENGINEERING DRAFTING TECHNICIAN        ,7532,2,,"  An Electrical Engineering Drafting Technician performs electrical drafting using a Computer Aided Design and Drafting (CADD) system in the preparation of engineering designs. An employee in this classification makes computations in the preparation and maintenance of electrical and communication design drawings, wiring diagrams, plans, and charts relating to the construction, operation, and maintenance of a wide variety of electrical installations and facilities.",1,"university, high school, college", ,2,full-time,,|the field of electrical engineering with one year full-time paid drafting experience using a CADD system., ,   ,,P, ,OPEN_INT_PROM,63902,69582,2018-11-30
166,ROOFER 3476 121214.txt,ROOFER                                                         ,3476,2,,"  A Roofer does skilled work in the application and repair of composition, asphaltic, and other types of roofing, such as tile, modified roll roofing, and single-ply systems; inspects roofs; prepares estimates; and may assume lead duties in the absence of the supervisor.",0,apprenticeship,"|the application of composition shingle| tile| modified roll roofing| single-ply systems| or ""built-up"" roofing.",5,full-time,,"|the application of composition shingle| tile| modified roll roofing| single-ply systems| or ""built-up"" roofing.", ,   ,,P, ,OPEN_INT_PROM,67797,68434,2014-12-12
167,CHIEF OF AIRPORT PLANNING 7945 032417 (3).txt,CHIEF OF AIRPORT PLANNING,7945,2,,"  A Chief of Airport Planning, under the general direction of senior management, directs, or assists in directing, the activities of professional and technical employees engaged in planning and development activities at the Los Angeles World Airports; applies sound supervisory principles and techniques in building and maintaining an effective work force; fulfills equal employment opportunity responsibilities; and does related work.",0,"university, college", ,4,full-time,,|airport-related planning| design| architecture| transportation| engineering| environmental activities or construction projects| two years of which are in a position at the level of Civil Engineer or City Planner directing and/or supervising employees engaged in such work., ,   ,,P, ,OPEN_INT_PROM,128067,-1,2017-03-24
168,WAREHOUSE AND TOOLROOM WORKER 1832 091418 REV 121218.txt,WAREHOUSE AND TOOLROOM WORKER,1832,2,,"  A Warehouse and Toolroom Worker performs manual and clerical work in ordering, receiving, storing, issuing, and accounting for materials, supplies, automotive parts, tools, and equipment; may be required to lift boxes, load and unload trucks, package materials and make supply deliveries; may operate motor-driven and various material handling and lifting equipment, including forklifts, jacks, and hoists. May perform minor repair, maintenance, and assembly on tools, equipment and materials; and does related work.",0,, ,1,full-time,,|a warehouse or stockroom receiving| storing| and accounting for materials or supplies; or | Utility Pre-Craft Trainee with the Department of Water and Power assisting with receiving| and accounting for materials or supplies in a warehouse or stockroom. , ,   ,,R,A,OPEN,48828,62670,2018-09-14
169,SENIOR COMPUTER OPERATOR 1428 102017.txt,SENIOR COMPUTER OPERATOR ,1428102017,2,,"  A Senior Computer Operator assigns, reviews, and evaluates the work of Computer Operators engaged in operating and monitoring computer systems and their peripheral equipment in the processing of business applications at central data processing facilities; operates and monitors computer systems and their peripheral equipment; and performs diagnostics and coordinates problem resolution for computer systems pertaining to batch production, workflow, and peripheral equipment performance with technical staff, vendors, and managers of one or more  communication systems to ensure the maximum availability of applications; may supervise a shift of Computer Operators and Senior Computer Operators in the shift supervisor's absence; applies sound supervisory principles and techniques in building and maintaining an effective work force; and fulfills equal employment opportunity responsibilities.   ",0,, ,2,full-time,Computer Operator,|the operation of large mainframe computer systems| with a Z/OS| OS/390| MVS| VSE/ESA| UNIX| or equivalent operating system| and a network supporting VTAM| and multiple CICS| DB2| IMS| or equivalent regions., ,   ,,P, ,OPEN_INT_PROM,64383,73006,2017-10-20
170,SENIOR FIRE PROTECTION ENGINEER 7981 021916 rev022516.txt,SENIOR FIRE PROTECTION ENGINEER,7981,3,,"  A Senior Fire Protection Engineer plans, organizes, and directs the work of Fire Inspectors, Fire Protection Engineers and Fire Protection Engineering Associates engaged in the fire and life safety review of building plans and field inspection for new construction projects; performs professional engineering work in the application of engineering principles to problems of safeguarding life and property against loss from fire, explosions and related hazards; applies sound supervisory principles and techniques in building and maintaining an effective work force; and fulfills equal employment opportunity responsibilities.",0,, ,2,full-time,,| Fire Protection Engineer; or| Fire Protection Engineering Associate III or IV., ,   ,,R, ,OPEN_INT_PROM,-1,-1,2016-02-19
171,TRANSPORTATION INVESTIGATOR 4271 061016.txt,TRANSPORTATION INVESTIGATOR,4271,2,,"  A Transportation Investigator makes investigations which may include the inspection of vehicles and other operating property, the interviewing of witnesses, complainants, or company personnel; makes arrests when essential to enforcement; processes permit applications; conducts administrative disciplinary hearings for drivers cited for violations; issues citations or hearing notices; and collects fees in enforcing public utility regulations or franchise provisions for the City of Los Angeles.  An employee in this class may be required to work various hours, shifts, and locations.",0,"university, college", ,2,full-time,,|the enforcement of laws or regulations| conducting inspections or investigations| or managing complaints pertaining to Municipal| State| or Federal codes| regulations| or laws.,justice,#Q 6 #S 4,,P, ,OPEN_INT_PROM,67746,-1,2016-06-10
172,GOLF STARTER 2453 121115.txt,GOLF STARTER,2453,2,,"  A Golf Starter registers and schedules players at a City-owned golf course; receives refunds and accounts for revenue from fees, rentals and sales; operates a POS (Point of Sale) system; explains and enforces rules and regulations of the Department of Recreation and Parks; and patrols courses to expedite play.",0,, ,1,full-time,,|golf course operations involving cash handling and direct public contact., ,   ,,R, ,OPEN,49798,-1,2015-12-11
173,CONSTRUCTION EQUIPMENT SERVICE WORKER 3541  012618.txt,CONSTRUCTION EQUIPMENT SERVICE WORKER,3541,2,,"  A Construction Equipment Service Worker fuels, lubricates, cleans and performs other non-repair servicing on construction and transportation equipment in a shop or from a service truck in the field; services a wide variety of heavy duty track-laying and heavy wheeled vehicles in yards and at construction sites; or may serve as an apprentice in one of the automotive crafts.",0,, ,1,full-time,,|servicing and lubricating construction vehicles exclusively; or|servicing and lubricating a combination of ALL of the following: cars| trucks and construction vehicles., ,   ,,R,B,OPEN_INT_PROM,51782,64080,2018-01-26
174,COMMUNITY PROGRAM ASSISTANT 2501 062218.txt,COMMUNITY PROGRAM ASSISTANT,2501,2,,"  A Community Program Assistant informs, assists, organizes and counsels members of the community on a variety of programs and services in the areas of social services, senior services, education, training, youth development, employment and counseling; networks with the public, local businesses and other public agencies to support and augment community based programs; prepares reports; may make presentations to the Mayor, City Council and City Departments; and performs other related work.",4,"university, college", ,4,full-time,,, ,   ,,P, ,OPEN,61450,-1,2018-06-22
175,SECRETARY 1116 030317.txt,SECRETARY,1116,0,,  A Secretary performs responsible secretarial duties and difficult clerical work requiring the use of independent judgment and a good knowledge of the functions of the organizational unit in which the position is located.,0,, ,1,full-time,,, ,   ,,P, ,OPEN_INT_PROM,59873,-1,2017-03-03
176,ELECTRIC STATION OPERATOR  5224 070717 (3).txt,ELECTRIC STATION OPERATOR,5224,6,,"  An Electric Station Operator operates high voltage electric and auxiliary equipment in hydroelectric generating, receiving and distributing stations and in high voltage DC Converter Plants; performs routine inspections, meter readings, and cleaning of high voltage equipment and facilities; prepares reports and documentation related to work activities in station; and does other related duties.",0,"university, high school, college","dustrial facilities such as oil refineries, chemical plants, or water treatment plants",1,,,|the maintenance or construction of electrical systems while in the United States Armed Forces; or, ,   ,,P, ,OPEN,62128,-1,2017-07-07
177,CRIMINALIST 2234 030918.txt,CRIMINALIST,2234,0,,"  A Criminalist searches for, collects and preserves physical evidence in the investigation of crime and suspected criminals; examines evidence by means of physical and chemical analyses; prepares reports of findings; and gives expert testimony in court.  At the highest pay grade, performs analyses of physical and chemical evidence of a nonroutine nature requiring advanced technology; and may serve as a lead worker by providing training and supervision to criminalists working in a specialized field. A Criminalist is subject to call at any hour and may work under unpleasant and adverse conditions, including high places, dangerous locations, and in proximity to dead bodies and biological and chemical hazards, in order to investigate crime scenes.",4,"university, college", a physical or natural science and successful completion of 8 semester or 12 quarter units in general chemistry.  ,0,,,,1,#Q 12 #S 8,,R, ,OPEN,80742,-1,2018-03-09
178,TREE SURGEON ASSISTANT 3151 060316.txt,TREE SURGEON ASSISTANT,3151,0,,  A Tree Surgeon Assistant assists in tree trimming and removal work and performs a variety of skilled and unskilled tasks on the ground and in the trees.,0,, ,1,full-time,,, ,   ,,R,B,OPEN,44485,48337,2016-06-03
179,PRINCIPAL ACCOUNTANT 1525 121517.txt,PRINCIPAL ACCOUNTANT,1525,0,,  A Principal Accountant directs or assists in directing the accounting and auditing work of a large City department or major unit of the central accounting and auditing office of the City; applies sound supervisory principles and techniques in building and maintaining an effective work force; and fulfills equal employment opportunity responsibilities.,0,, ,2,full-time,Senior Accountant,, ,   ,,P, ,OPEN_INT_PROM,95828,-1,2017-12-15
180,AIRPORT POLICE LIEUTENANT 3227 091616.txt,AIRPORT POLICE LIEUTENANT,3227,0,,"  An Airport Police Lieutenant plans, supervises, directs and controls employees of the Airport Police Division of the Los Angeles World Airports (LAWA), civilian and sworn, during a specific time period, watch, or in a particular unit; applies sound supervisory and management techniques to ensure the mission of the Airport Police Division of the Los Angeles World Airports is met through the enforcement of federal, state and local laws and regulations, City of Los Angeles ordinances, Airport Security Program requirements and airport rules and regulations at any of the four City of Los Angeles airports; and does other related work.",0,, ,2,full-time,,|n Airport Police Sergeant with the Los Angeles World Airports| or in a class at that level| one year of which must have involved full-time responsibility for the deployment and functioning of law enforcement| safety| and security personnel in the performance of their duties at a Los Angeles World Airports facility., ,   ,,R, ,OPEN_INT_PROM,118107,-1,2016-09-16
181,SENIOR SURVEY SUPERVISOR 7288 081718.txt,SENIOR SURVEY SUPERVISOR,7288,2,,"  A Senior Survey Supervisor assigns, reviews and evaluates the work of technical employees engaged in field survey work; applies sound supervisory principles and techniques in building and maintaining an effective work force; and fulfills equal employment opportunity responsibilities. ",0,, ,2,full-time,,| Survey Supervisor or in a class which is at that level and which provides experience in directing land and engineering survey work; and, ,   ,,R, ,OPEN_INT_PROM,128015,44243,2018-08-17
182,ART INSTRUCTOR 2447 051316.txt,ART INSTRUCTOR,2447,2,,"  An Art Instructor teaches visual, performing, and communications arts to classes of children, youth, and adults; designs, implements and coordinates the art instruction program of a center; and teaches interpretation programs in arts or architecture at arts centers, museums, and historic sites operated by the City.",4,"university, college"," fine arts, performing arts, art history, architectural history, or art education",0,,,|the arts or art education.|Requirement No. 2 may be substituted on a year-for-year basis for the required education lacking., ,   ,,P, ,OPEN,53536,-1,2016-05-13
183,SENIOR COMMUNICATIONS ELECTRICIAN 3638 030317 (1).txt,SENIOR COMMUNICATIONS ELECTRICIAN,3638,0,,"  A Senior Communications Electrician acts as a lead for and works with a small group of employees engaged in the construction, installation, repair, maintenance, and modification of communication systems and equipment such as: radio, microwave transmission, Local Area Network/Wide Area Network data distribution systems, telephone networks, audio, avionic electronics, intrusion alarm systems, mobile digital terminals, dispatch networks, copper and fiber-optic cable systems, video distribution systems, supervisory control and data acquisition (scada), and transmission systems.",0,, ,2,full-time,,|a class at least at the level of Communications Electrician engaged in the construction| installation| operation| repair| maintenance| or modification of electronic communication systems., ,   ,,P, ,OPEN_INT_PROM,94941,114568,2017-03-03
184,PRINCIPAL ELECTRIC TROUBLE DISPATCHER 3830 022616.txt,PRINCIPAL ELECTRIC TROUBLE DISPATCHER,3830,2,,"  A Principal Electric Trouble Dispatcher plans, organizes, directs and coordinates the work of the Electric Trouble Dispatching team comprised of several shifts engaged in receiving and analyzing electric trouble complaints, and dispatching personnel and equipment to clear and repair the trouble and restore service; operates various computer systems and updates databases related to computerized Electric Trouble Dispatching; arranges for and issues Work Authorities on the Department's overhead and underground 7,500-volt and below electric system; approves plans and schedules for switching on the Department's distribution system; applies sound supervisory principles and techniques in building and maintaining an effective work force; and fulfills equal employment opportunity responsibilities. ",0,, ,2,full-time,Senior Electric Trouble Dispatcher,, ,   ,,P, ,OPEN_INT_PROM,113754,-1,2016-02-26
185,AUTO BODY REPAIR SUPERVISOR 3706 051515.txt,AUTO BODY REPAIR SUPERVISOR,3706,0,,"  An Auto Body Repair Supervisor assigns, reviews and evaluates the work of a group of employees engaged in fabricating, installing, remodeling, or repairing bodies and body accessories of automotive and miscellaneous equipment; applies sound supervisory principles and techniques in building and maintaining an effective work force; and fulfills equal employment opportunity responsibilities.",0,, ,2,full-time,,|n Auto Body Builder and Repairer| or in a class at that level which provides journey-level experience in fabricating| installing| remodeling| or repairing bodies and body accessories of automotive equipment., ,   ,,R,A,OPEN_INT_PROM,79406,95244,2015-05-15
186,EQUIPMENT SPECIALIST 3734 111717 revised 11.21.txt,EQUIPMENT SPECIALIST,3734,3,,"  An Equipment Specialist determines departmental equipment needs; prepares specifications; inspects equipment received from vendors; makes recommendations in connection with the purchase, operation, and maintenance of a wide variety of transportation, construction, fire, recreation, and park maintenance equipment; or participates in and supervises such work; and does related work.",0,"university, college", ,4,full-time,Equipment Mechanic,|the maintenance and repair of transportation| construction| fire| or park maintenance equipment| or in the analysis of either the operation or maintenance and repair of transportation| fire or park maintenance equipment.,of,#Q 90 #S 60,,R,B,OPEN_INT_PROM,77245,86004,2017-11-17
187,ELECTRIC TROUBLE DISPATCHER 3828 063017 (1).txt,ELECTRIC TROUBLE DISPATCHER,3828,0,,"  An Electric Trouble Dispatcher receives and analyzes electric trouble complaints, and dispatches personnel and equipment to clear and repair the trouble and restore service; operates various computer systems programs and updates data bases related to computerized Electric Trouble Dispatching; receives reports from field crews and relays information to other sections and divisions; updates necessary maps, drawings, and prints; prepares and forwards repair memos and other information to other business groups and teams; arranges for and issues Work Authorities on overhead and underground circuits; and plans, schedules, and directs switching on the Department's 7,500-volt and below overhead and underground circuits, lines and equipment under the jurisdiction of the Electric Trouble Board.",0,, ,4,full-time,,|the construction| operation| maintenance| or repair of electrical transmission or distribution equipment| street lighting electrical equipment| or electrical systems used in residential| commercial| or industrial installations., ,   ,,P, ,OPEN_INT_PROM,72150,-1,2017-06-30
188,POLICE DETECTIVE 2223 033018.txt,POLICE DETECTIVE,2223,2,,  A Police Detective performs investigations of crimes; does surveillance work to detect or prevent crime; may supervise or coordinate the activities of a detail or unit engaged in investigating various crimes or activities; and does related work. ,0,"university, college", ,0,,,, ,   ,,NoR, ,DEPT_PROM,104149,-1,2018-03-30
189,BUS OPERATOR SUPERVISOR 3589 012216.txt,BUS OPERATOR SUPERVISOR,3589,2,,"  A Bus Operator Supervisor plans, organizes, directs and coordinates the activities of a group of Bus Operators, including providing training and instructions in airfield bus operations; applies sound supervisory principles and techniques in building and maintaining an effective work force; and fulfills equal employment opportunity responsibilities.",0,, ,1,full-time,Bus Operator City Los Angeles,| bus dispatcher or bus operator supervisor and one year of full-time paid experience driving a bus with a passenger capacity of 40 seats or larger., ,   ,,R, ,OPEN_INT_PROM,65886,-1,2016-01-22
190,PRINCIPAL STOREKEEPER 1839 072718.txt,PRINCIPAL STOREKEEPER,1839,0,,"  A Principal Storekeeper manages a major supply distribution system, which may include a variety of distribution centers, warehouses, and stores serving other departments; or acts as assistant to a Stores Supervisor or Supply Services Manager; applies sound managerial and supervisory principles and techniques in supervising an effective work force; fulfills equal employment opportunity responsibilities; and does related work.",0,, ,2,full-time,,| Senior Storekeeper or in a class which is at that level managing inventory control| procurement and other warehouse functions., ,   ,,P, ,OPEN_INT_PROM,86401,107030,2018-07-27
191,CUSTODIAN SUPERVISOR 3176 042817 051117 REV.txt,CUSTODIAN SUPERVISOR,3176,2,AB,"  A Custodian Supervisor assigns, reviews and evaluates the work of one or more groups of custodial employees engaged in a variety of cleaning and custodial tasks in City buildings, creates memorandums and supervisory paperwork on computers, communicates effectively via verbal, written and electronic formats, applies sound supervisory principles and techniques in building and maintaining an effective work force and fulfills equal employment opportunity responsibilities.  ",0,, ,4,full-time,,, ,   ,,P, ,OPEN_INT_PROM,44192,49350,2017-04-28
192,PIPEFITTER 3433 080318.txt,PIPEFITTER,3433,3,,"  A Pipefitter does skilled work in the installation, replacement, maintenance, and repair of industrial steam, oil, air, gas, water, steam heating and other pipe systems, including high pressure and high temperature systems.",0,apprenticeship,,5,full-time,Mechanical Helper,, ,   ,,P, ,OPEN_INT_PROM,94455,101622,2018-08-03
193,SENIOR HEATING AND REFRIGERATION INSPECTOR 4247 121115.txt,SENIOR HEATING AND REFRIGERATION INSPECTOR,4247,2,B,"  A Senior Heating and Refrigeration Inspector supervises a group of employees engaged in the inspection of installations of heating, ventilating, air-conditioning, and refrigeration equipment; and inspects the larger and more complex systems.",4,"university, college", ,2,full-time,Heating Refrigeration Inspector City Los Angeles,, ,   ,,R, ,OPEN_INT_PROM,89586,-1,2015-12-11
194,SENIOR COMMUNICATIONS OPERATOR 1467 122118.txt,SENIOR COMMUNICATIONS OPERATOR,1467,0,,"  A Senior Communications Operator assigns, reviews, evaluates and provides direct supervision to Communications Information Representatives who operate telephone and radio consoles and are responsible for receiving and processing requests for service and information using a computer based system; and does related work. A Senior Communications Operator applies City policies, sound supervisory principles and techniques to build and maintain an effective workforce and satisfy equal employment opportunity responsibilities.",0,, ,2,full-time,Communications Information Representative,, ,   ,,P, ,OPEN_INT_PROM,64936,62670,2018-12-21
195,AUTO ELECTRICIAN 3707 052215.txt,AUTO ELECTRICIAN                 ,3707,2,,"  An Auto Electrician diagnoses, tests, adjusts and repairs automotive, truck and construction equipment, electrical and fuel supply parts, systems and accessories.",0,apprenticeship,,5,full-time,,, ,   ,,R,B,OPEN_INT_PROM,71221,77276,2015-05-22
