,FILE_NAME,JOB_CLASS_TITLE,JOB_CLASS_NO,REQUIREMENT_SET_ID,REQUIREMENT_SUBSET_ID,JOB_DUTIES,EDUCATION_YEARS,SCHOOL_TYPE,EDUCATION_MAJOR,EXPERIENCE_LENGTH,FULL_TIME_PART_TIME,EXP_JOB_CLASS_TITLE,EXP_JOB_CLASS_FUNCTION,COURSE_COUNT,COURSE_LENGHT,COURSE_SUBJECT,DRIVERS_LICENSE_REQ,DRIV_LIC_TYPE,EXAM_TYPE,ENTRY_SALARY_GEN,ENTRY_SALARY_DWP,OPEN_DATE
315,SENIOR LABOR RELATIONS SPECIALIST 9202 11618.txt,SENIOR LABOR RELATIONS SPECIALIST,9202,2,,"  A Senior Labor Relations Specialist performs complex and sensitive labor relations activities, including negotiating Memoranda of Understanding (MOUs) with unions representing City employees; administering the terms of the MOUs; and preparing analyses, proposals, reports, and correspondence in the field of labor relations; and does related work.",4,"university, college", ,2,full-time,,|n advocate in administrative hearings., ,   ,,P, ,OPEN_INT_PROM,131512,-1,2018-11-16
316,FIREFIGHTER 2112 011918.txt,FIREFIGHTER,2112,3,,"  As members of the Los Angeles Fire Department, a Firefighter's duties include engaging directly in firefighting, emergency medical services requiring assignment to a rescue ambulance, mitigation of hazardous materials emergencies, fire prevention and rescue, and inspections of buildings and properties to ensure compliance with the fire codes.  All Firefighters are required to become Emergency Medical Technicians (EMT) and may be required to become Paramedics.",0,high school, ,0,,,, ,   ,,NoR, ,OPEN,67264,-1,2018-01-19
317,PRINCIPAL ELECTRICAL ENGINEERING DRAFTING TECHNICIAN 7531 090916 TRACK CHANGES.txt,PRINCIPAL ELECTRICAL ENGINEERING DRAFTING TECHNICIAN,7531,0,,"  A Principal Electrical Engineering Drafting Technician plans, organizes, and directs the work of drafting personnel in a major engineering drafting unit engaged in the preparation of electrical engineering drawings and plans for Los Angeles City construction projects; maintains project records; assists in the development and implementation of computer-aided-drafting (CAD), automated drafting program standards, and data management systems storage; manages the retrieval of electronic drawing files; provides drafting-related information relative to proposed work; and defines the job scope as it pertains to drafting work with engineers and contractors. Applies sound supervisory principles and techniques in building and maintaining an effective work force; and fulfills equal employment opportunity responsibilities.",0,, ,3,full-time,,| Senior Electrical Engineering Drafting Technician| or in a class at that level supervising electrical engineering drafting technicians., ,   ,,NoR, ,OPEN_INT_PROM,99158,-1,2016-09-09
318,INFORMATION SERVICES SPECIALIST 1456 080417 (1).txt,INFORMATION SERVICES SPECIALIST,1456,2,,"  An Information Services Specialist assists in the evaluation, development, maintenance, implementation and modification of host-based, departmental processor, and personal computer operating systems, program product and supporting software; assists in planning and documenting facility and equipment-related activities; coordinates computer equipment installations, removals, modifications, and maintenance; develops host-based computer software or hardware procedures and assists in the analysis and resolution of network and hardware problems; performs analytic monitoring of computer systems in an operations center environment.",0,, ,2,full-time,,|the installation| operation| programming| analysis| design| or data control of hardware or software for small| medium and large-scale computers| in performing simple system user requirements analysis and trouble shooting., ,   ,,P, ,OPEN_INT_PROM,73466,82486,2017-08-04
319,ELECTRIC DISTRIBUTION MECHANIC 3879 040717.txt,ELECTRIC DISTRIBUTION MECHANIC,3879,3,ABCD,"  An entry-level Electric Distribution Mechanic works as a trainee under close supervision of journey-level workers. Trainees receive extensive classroom training as well as on the job training as a cable splicer and as a line mechanic. Electric Distribution Mechanic trainees assist in the construction, maintenance and repair of overhead electric power sub-transmission and distribution lines and equipment; constructs high-voltage distribution pole lines; makes construction changes to existing lines and equipment; repairs power lines and line equipment; repairs and reroutes services; sets poles; installs transformer racks; hangs and installs transformers and switches of various types and sizes; installs overhead street lights and guy wires; makes repairs to energized lines; performs limited line clearance tree trimming; installs watt-hour meters; uses appropriate live line  tools to install and remove approved protective covering on energized distribution and sub-transmission circuits of 7.5kV and above; and climbs poles. Electric Distribution Mechanic trainees assist in the construction, maintenance, and repair of underground electric power, transmission, sub-transmission, and distribution cable work.  Performs work activities in connection with underground cable installation and removal; pulls cables and service lines through sub-structures, vaults, duct lines, up poles and walls, over roofs of buildings and to customers' service panels; performs rigging operations of cable pulling equipment; installs and removes transformers and related equipment in vaults and sub-structures; splices energized and de-energized low-voltage cables, splices high voltage de-energized cables; maintains gas and oil filled cable and equipment; installs watt hour meters; and climbs poles as related to underground work. A journey-level Electrical Distribution Mechanic performs skilled mechanical and electrical work in connection with the construction, maintenance, and repair of energized and/or de-energized overhead and underground electric transmission, subtransmission, distribution, communication, and utilitarian street light lines, cables, and equipment; and may work as lead over a group of skilled craft workers.",0,"college, apprenticeship",|and on high-voltage power poles| transmission towers| and underground electric substructures. Six months experience must be specific to assisting with and/or performing work at voltages of 4.16-kV and above; or|the maintenance or construction of electrical distribution systems while in the United States Armed Forces; or,6,full-time,,|and on high-voltage power poles| transmission towers| and underground electric substructures. Six months experience must be specific to assisting with and/or performing work at voltages of 4.16-kV and above; or|the maintenance or construction of electrical distribution systems while in the United States Armed Forces; or, ,   ,,R,A,OPEN_INT_PROM,85336,-1,2017-04-07
320,UNDERGROUND DISTRIBUTION CONSTRUCTION SUPERVISOR 3814 121418 REV 122718 (1).txt,UNDERGROUND DISTRIBUTION CONSTRUCTION SUPERVISOR,3814,0,,"  An Underground Distribution Construction Supervisor assigns, reviews, and evaluates the work of a group of technical employees engaged in the construction, maintenance, and repair of underground ducts, maintenance holes, and vaults; applies sound supervisory principles and techniques in building and maintaining an effective work force; and fulfills equal employment opportunity responsibilities.",0,, ,3,full-time,Underground Distribution Construction Mechanic,, ,   ,,R, ,OPEN_INT_PROM,113556,-1,2018-12-14
321,CONTRACT ADMINISTRATOR 9168 031017.txt,CONTRACT ADMINISTRATOR ,9168,2,,"  A Contract Administrator supervises professional employees engaged in the development, negotiation, preparation, and enforcement of contracts for the design and construction of municipal recreational facilities and public improvement projects for the City of Los Angeles; applies sound supervisory principles and training techniques in building and maintaining an effective work force; and fulfills equal employment opportunity responsibilities. ",0,"university, college", ,2,full-time,,, ,   ,,R, ,OPEN_INT_PROM,126470,-1,2017-03-10
322,PARK SERVICES ATTENDANT 2412 032219.txt,PARK SERVICES ATTENDANT,2412,1,,"  A Park Services Attendant serves the public at, or operates, amusement, tennis reservation, lodge, auditorium, information booth or service facilities at City parks or recreational areas; or supervises such work in a lead capacity.",0,, ,0,,,, ,   ,,P, ,OPEN,37730,-1,2019-03-22
323,EMERGENCY MANAGEMENT COORDINATOR 1702 102618.txt,EMERGENCY MANAGEMENT COORDINATOR,1702,3,,"  An Emergency Management Coordinator is responsible for developing, coordinating, implementing, and administering comprehensive emergency management programs including disaster preparedness, response, recovery, and mitigation Citywide or for individual City departments, including developing and maintaining emergency response and continuity of operations plans, standard operating procedures, and related training programs, exercises and drills; performs community education and outreach programs on disaster preparedness and planning; works with other City departments, governmental and private agencies, and community based organizations to develop and implement emergency management programs for the City of Los Angeles; analyzes and prepares comprehensive reports, research, recommendations, and correspondence for their assigned department or other administrative bodies as directed; may be assigned emergency response roles in various locations; and may supervise other Emergency Management Coordinators, City employees in other classifications, and/or volunteers involved in emergency management work. ",0,"university, college"," emergency management, homeland security, or public health may be substituted for a maximum of one year of the required experience.",4,full-time,,, ,   ,,R, ,OPEN_INT_PROM,101904,109588,2018-10-26
324,PLANNING ASSISTANT 7939 071417 REV 072617 (1).txt,PLANNING ASSISTANT,7939,2,,"  A Planning Assistant does professional city planning work in long-range and policy planning, including citywide, community, and neighborhood planning; and project planning, including review, analysis, and clearance of land use proposals, development projects, and site plans. A Planning Assistant may have specialized expertise in historic preservation, environmental analysis, and/or zoning review and compliance.",4,"university, college"," urban planning, urban studies, urban design, architecture, landscape architecture, geography, public administration, political science, environmental science, social ecology, economics, transportation planning, or historic preservation",4,full-time,Planning Aide,, ,   ,,P, ,OPEN,75920,-1,2017-07-14
325,ELECTRICAL TESTER 7512 102816.txt,ELECTRICAL TESTER   ,7512,5,,"  An entry-level Electrical Tester receives intensive classroom and on-the-job instruction and training. The trainee is supervised by a Senior Electrical Tester and works as a trainee assisting journey-level electrical workers within the Testing Laboratories in the performance of diagnostic tests, calibration, repair, maintenance, and adjustments on: high and low voltage electrical circuits, equipment and related material; meters, smart-grid systems, conventional and renewable generation resources, control circuits, instruments, relays and related equipment and materials; new locations; and performs related duties. A journey-level Electrical Tester: performs routine calibration tests of meters; makes routine electrical tests of material; assists in testing more complex electric instruments and equipment; tests and replaces electric meters, control and protective relays, instruments, transformers, and other equipment and materials; performs cathodic protection in underground and abovehead structures; performs infrared inspection of high voltage overhead distribution systems; and builds and test circuit boards, removes or replaces components, and tests communication levels, in regard to facility/substation Supervisory Control and Data Acquisition (SCADA) systems, Remote Terminal Units (RTU), and other control systems. Journey-level Electrical Testers may also: lead a group of employees engaged in field or laboratory electrical testing; perform the more difficult and advanced functions of electrical testing; and perform related duties. ",0,"university, college", ,6,full-time,,| helper or trainee for a utility performing work on equipment and circuits| construction and maintenance; or|the maintenance or construction of electrical systems while in the United States Armed Forces., ,   ,,R, ,DEPT_PROM,60624,-1,2016-10-28
326,HOUSING PLANNING AND ECONOMIC ANALYST 8504 Bulletin FINAL DRAFT.txt,HOUSING PLANNING AND ECONOMIC ANALYST,8504,2,,"  A Housing Planning and Economic Analyst performs responsible administrative and technical work in the preparation of economic research, reports and feasibility studies related to policy analysis, housing policy, program development, legislation and affordable housing preservation, development and financing.",4,"university, college", ,2,full-time,,|planning| financing and/or analysis of low-income or moderate-income affordable housing., ,   ,,R, ,OPEN_INT_PROM,89814,-1,2018-08-10
327,DIRECTOR OF ENFORCEMENT OPERATIONS 4266 012618.txt,DIRECTOR OF ENFORCEMENT OPERATIONS,4266,3,,"  A Director of Enforcement Operations plans, coordinates, and directs or assists in directing the activities of a Division which is responsible for carrying out the City's systematic and complaint inspection programs, rent stabilization programs, and habitability enforcement programs; or the development and direction of specialized housing programs; oversees administrative and budgetary matters of the Division; applies sound supervisory principles and techniques in building and maintaining an effective work force; and fulfills equal employment opportunity responsibilities.",4,"university, college", ,4,full-time,,|any of the following areas:  the management and administration of a housing habitability enforcement program or the management and administration of a rent stabilization/rent control program; or|n attorney which provides experience in civil or criminal enforcement actions related to housing habitability matters or rent stabilization/rent control matters; or, ,   ,,P, ,OPEN_INT_PROM,151504,-1,2018-01-26
328,WATER UTILITY SUPERVISOR 3976 050418 (1).txt,WATER UTILITY SUPERVISOR,3976,2,,"  A Water Utility Supervisor assigns, reviews and evaluates the work of employees engaged in installing, maintaining, replacing, and repairing water mains, services, irrigation systems, fire hydrants and appurtenant valves and equipment; applies sound supervisory principles and techniques in building and maintaining an effective work force; and fulfills equal employment opportunity responsibilities.",0,, ,4,full-time,Water Utility Worker Water Service Worker,, ,   ,,R, ,OPEN_INT_PROM,100422,-1,2018-05-04
329,PRINCIPAL SECURITY OFFICER 3200 110218.txt,PRINCIPAL SECURITY OFFICER,3200,0,,"  A Principal Security Officer assists in directing, or personally directs, a large group of Security Officers and Senior Security Officers engaged in patrolling and safeguarding buildings and their occupants, grounds and equipment, in crowd and traffic control and protocol duties; supervises the investigation of accidents, thefts and disturbances; applies sound supervisory principles and techniques in building and maintaining an effective work force; fulfills equal employment opportunity responsibilities; and does related work.",0,, ,1,full-time,Senior Security Officer,, ,   ,,P, ,OPEN_INT_PROM,61428,78236,2018-11-02
330,AUTOMOTIVE SUPERVISOR 3714 062416.txt,AUTOMOTIVE SUPERVISOR,3714,0,,"  An Automotive Supervisor assigns, reviews and evaluates the work of a group of journey-level and other employees performing skilled mechanical, electrical, and related work in the maintenance and repair of transportation equipment; maintains regulatory compliance; applies sound supervisory principles and techniques in building and maintaining an effective work force; and fulfills equal employment opportunity responsibilities.",0,, ,4,full-time,,| journey-level equipment mechanic., ,   ,,R,B,OPEN_INT_PROM,89470,92540,2016-06-24
331,SENIOR UTILITY SERVICES SPECIALIST 3573 113018.txt,SENIOR UTILITY SERVICES SPECIALIST,3753,0,,"  A Senior Utility Services Specialist assigns, reviews, evaluates, and may assist in the work of employees engaged in the marketing, efficient use and conservation of electric energy and water among residential, commercial, industrial, governmental and institutional customers; develops and implements marketing plans and strategies; oversees various marketing and customer outreach support functions; develops and implements energy and water efficiency programs; manages large commercial accounts; facilitates resolution of complex customer issues; conducts energy and water surveys and audits; advises residential, business and commercial customers on conservation techniques and practices, business solutions, and products and services; applies sound supervisory principles and techniques in building and maintaining an effective work force; fulfills equal employment opportunity responsibilities; and does related work.",0,, ,2,full-time,Utility Services Specialist,, ,   ,,R, ,OPEN_INT_PROM,131398,-1,2018-11-30
332,TRANSPORTATION ENGINEER 7278 092917.txt,TRANSPORTATION ENGINEER,7278,2,,"  A Transportation Engineer performs responsible transportation engineering work in making engineering studies and preparing or supervising the preparation of designs, plans, specifications, estimates, and reports; in supervising the collection of field data in connection with a variety of transportation, traffic safety, and parking projects; in communicating effectively with the public, elected officials, and other agencies; applies sound supervisory principles and techniques in building and maintaining an effective work force; and fulfills equal employment opportunity responsibilities.",0,, ,2,full-time,,|a position at the level of Transportation Engineering Associate II| Class Code 7280; and, ,   ,,P, ,OPEN_INT_PROM,108596,-1,2017-09-29
333,COMMUNICATIONS CABLE WORKER 3802 11816.txt,COMMUNICATIONS CABLE WORKER,3802,0,,"  A Communications Cable Worker does skilled electrical work in the installation, splicing, termination, maintenance, changing, removal, location of trouble, and repair of outside and inside plant overhead and underground fiber optic and paired copper communications cables, lines, and appurtenant equipment including the telephone, data, alarm, carrier, supervisory, telemetry, and control circuits contained within these cables and lines.",0,"university, college", ,2,full-time,,| helper to a journey-level electrical worker in the construction| installation| maintenance| and repair of fiber optic and lead or plastic sheathed communications type cables and control lines containing control| telemetering or telephone circuits.,1,#Q 45 #S 30,,R,A,OPEN_INT_PROM,71910,52,2016-11-18
334,CRIME AND INTELLIGENCE ANALYST  2236  062918.txt,CRIME AND INTELLIGENCE ANALYST ,2236,2,,"  A Crime and Intelligence Analyst researches, compiles, analyzes, and maps crime trends and patterns; disseminates information related to criminal activity; assists patrol, investigative, and administrative staff in planning the deployment of resources for the prevention, intervention, and suppression of criminal activities; acts as liaison to all Los Angeles Police Department and neighboring law enforcement Crime Analysis Details; may act as lead analyst; and performs related work.",4,"university, college", ,2,full-time,,|a class at the level of Management Assistant performing duties in researching| compiling| and analyzing crime trends and patterns in a law enforcement agency; or, ,   ,,P, ,OPEN,73226,-1,2018-06-29
335,PERSONNEL ANALYST 1731 092118 REV 092618.txt,PERSONNEL ANALYST,1731,3,,"  A Personnel Analyst performs professional staff work by assembling, analyzing, and interpreting data and by preparing correspondence and reports with recommendations to management on diverse personnel administration activities, issues, and problems; provides advice and guidance to internal and external customers; may supervise or act as a lead worker to staff involved in personnel management activities.",4,"university, college", ,1,full-time,,|a class at the level of Management Assistant performing professional duties in personnel administration; administrative analysis| or departmental administration; or| Management Aide in Requirement #2., ,   ,,P, ,OPEN_INT_PROM,86359,-1,2018-09-21
336,REINFORCING STEEL WORKER 3483 022318.txt,REINFORCING STEEL WORKER       ,3483,0,,"  A Reinforcing Steel Worker cuts, shapes, assembles, places, and ties steel rods, wire, and wire mesh to reinforce concrete.",0,, ,2,full-time,,|all of the following areas: cutting| shaping| assembling| placing| and tying reinforcing steel| which must include rods and wire mesh., ,   ,,R,A,OPEN_INT_PROM,88030,-1,2018-02-23
337,PRINCIPAL INSPECTOR 4226 061617.txt,PRINCIPAL INSPECTOR,4226,0,,"  A Principal Inspector plans, organizes and directs the operation and activities of a section or assists in similar activities in a division involved in building, electrical, plumbing, grading, mechanical, elevator, or pressure vessel inspections and code enforcement or habitability inspection activities; applies sound supervisory principles and techniques in building and maintaining an effective workforce; and fulfills equal employment opportunity responsibilities.",0,, ,2,full-time,Building Building Mechanical Electrical Plumbing Fire Sprinkler Heating Refrigeration Housing Elevators Pressure Vessels,, ,   ,,P, ,OPEN_INT_PROM,106342,-1,2017-06-16
338,SIGNAL SYSTEMS ELECTRICIAN 3819 042018.txt,SIGNAL SYSTEMS ELECTRICIAN  ,3819,3,,"  A Signal Systems Electrician performs skilled technical work and may act as a lead for and work with a signal construction or signal systems crew installing, repairing, maintaining, and modifying electric and microprocessor based traffic signal control devices and video and computer communications systems.",0,"university, college, apprenticeship",|electrical or electronic control work; or,0,apprenticeship,,|electrical or electronic control work; or, ,   ,,R,B,OPEN_INT_PROM,90645,-1,2018-04-20
339,SIGNAL SYSTEMS SUPERINTENDENT 3832 110416.txt,SIGNAL SYSTEMS SUPERINTENDENT,3832,0,,"  A Signal Systems Superintendent directs, through subordinate supervisors, the construction, maintenance, and repair of traffic signals on a City-wide basis. An employee of this class determines general procedures within the framework of applicable laws and Department of Transportation regulations and policies. The work involves difficult scheduling and coordination problems. The work of the division occurs throughout the City, is often interrelated with the needs of other units, and is sometimes of an emergency nature. ",0,, ,2,full-time,Signal Systems Supervisor,, ,   ,,R, ,OPEN_INT_PROM,112313,-1,2016-11-04
340,PUBLIC SAFETY RISK MANAGER 7976 102618.txt,PUBLIC SAFETY RISK MANAGER,7976,2,,"  A Public Safety Risk Manager administers a comprehensive risk management program within the Los Angeles Fire Department (LAFD) which includes identifying potential risk exposures in all operations, evaluating the likelihood of these risks, and preparing and recommending policies or procedures to mitigate or eliminate such risks. Evaluates the effectiveness of the risk reduction measures within the context of the public safety and emergency response obligation of the LAFD.",4,"university, college", ,2,full-time,Risk Manager,|the administration of a risk management program. , ,   ,,R, ,OPEN_INT_PROM,135135,-1,2018-10-26
341,PRINCIPAL CITY PLANNER 7946 030218.txt,PRINCIPAL CITY PLANNER                                       ,7946,2,,"  A Principal City Planner plans, organizes, and directs the work of professional, technical, and clerical employees in a major division of the City Planning Department; applies sound supervisory principles and techniques in building and maintaining an effective workforce; fulfills equal employment responsibilities; and does related work.",0,, ,2,full-time,Senior City Planner,|an organization engaged in urban or regional planning| redevelopment| land use administration| or a closely related field., ,   ,,P, ,OPEN_INT_PROM,151504,-1,2018-03-02
342,UTILITY ADMINISTRATOR 9105 060217.txt,UTILITY ADMINISTRATOR,9105,0,,"  A Utility Administrator plans, directs, organizes and coordinates work and resources; directs professional, technical, and clerical personnel in performing a wide range of administrative, financial, budgetary, personnel, labor relations and staff support activities ranging from the section to the departmental level in the Department of Water and Power; may personally perform, or perform through subordinate supervisors, the more difficult and complex work; applies sound supervisory principles and techniques in building and maintaining an effective work force; and fulfills equal employment opportunity responsibilities.",0,"university, college", ,2,full-time,,| Management Analyst or in a class at that level which provides professional experience in budget formulation and control| financial administration| administrative analysis of departmental programs| human resources/personnel administration| or contract administration., ,   ,,P, ,OPEN_INT_PROM,109160,-1,2017-06-02
