,FILE_NAME,JOB_CLASS_TITLE,JOB_CLASS_NO,REQUIREMENT_SET_ID,REQUIREMENT_SUBSET_ID,JOB_DUTIES,EDUCATION_YEARS,SCHOOL_TYPE,EDUCATION_MAJOR,EXPERIENCE_LENGTH,FULL_TIME_PART_TIME,EXP_JOB_CLASS_TITLE,EXP_JOB_CLASS_FUNCTION,COURSE_COUNT,COURSE_LENGHT,COURSE_SUBJECT,DRIVERS_LICENSE_REQ,DRIV_LIC_TYPE,EXAM_TYPE,ENTRY_SALARY_GEN,ENTRY_SALARY_DWP,OPEN_DATE
495,PRINCIPAL DEPUTY CONTROLLER 7260 032814.txt,PRINCIPAL DEPUTY CONTROLLER,9653,2,,"  A Principal Deputy Controller serves in the Office of the Controller as the top operations accounting employee for the City of Los Angeles and provides oversight to all City accounting operations with a total budget of over $20 billion. The position is responsible for the day-to-day operations for the City's Accounting and Disbursement systems, including but not limited to: overseeing the bi-weekly payroll for over 45,000 employees with an average total bi-weekly expenditure of over $131 million; overseeing the review, approval, and disbursement of all payments with an average annual expenditure of over $5 billion; proposing policy changes on financial and accounting matters and making recommendations to the Controller; overseeing Citywide accounting training; and overseeing the City's fund accounting including the set-up and control of the City's budgetary appropriations and funds. The position directs the activities of the Controller's Office in the absence of the Controller and Chief Deputy Controller; applies sound supervisory and management principles and techniques in building and maintaining an effective work force; fulfills equal employment opportunity responsibilities; and does related work.",4,college," accounting, business administration, public administration or a related field",2,full-time,,|managing a large centralized governmental accounting operation| including disbursement operations| in a position at least at the level of a Departmental Chief Accountant IV| and which includes professional managerial experience in all aspects of accounting and in the analysis| design| or development of computer-based financial systems., ,   ,,NoR, ,OPEN_INT_PROM,163542,-1,2014-03-28
496,SENIOR ELECTRICAL MECHANIC 3834 060217 (2) REVISED.txt,SENIOR ELECTRICAL MECHANIC,3834,0,,"  A Senior Electrical Mechanic acts as lead for and works with a small group of Electrical Mechanics and helpers performing skilled electrical and mechanical work in installing and maintaining electric equipment in electric stations, generating plants, pumping and chlorinating stations, buildings, and similar facilities.",0,, ,2,full-time,Electrical Mechanic,, ,   ,,R,A,OPEN_INT_PROM,111540,-1,2017-06-02
497,SENIOR ADMINISTRATIVE ANALYST 1541 070618.txt,SENIOR ADMINISTRATIVE ANALYST,1541,2,,"  A Senior Administrative Analyst performs responsible professional work involving analyses and recommendations in the fields of budget planning and monitoring, budget investigation and preparation, capital improvement programming, contracts, personnel utilization and control, grants, economic development projects, systems and technology projects, proprietary department programs and special studies; and represents the City Administrative Officer before the Mayor, the City Council and its committees, department heads, citizens, employees, and labor representatives.",0,"university, college", ,2,full-time,Administrative Analyst,|a class at the level of Management Analyst in budgetary analysis and control| administrative and legislative analysis and research| departmental administration| or personnel administration., ,   ,,P, ,OPEN_INT_PROM,106268,-1,2018-07-06
498,SENIOR COMMERCIAL FIELD REPRESENTATIVE 1602 042817 REV 051117.txt,SENIOR COMMERCIAL FIELD REPRESENTATIVE,1602,2,,"  A Senior Commercial Field Representative performs highly technical inspections of water and electric meters and service for compliance with Department of Water and Power rules and regulations; estimates and determines charges for unmetered water and electricity; independently performs difficult customer service-related work; communicates directly with customer to investigate and resolve disputes regarding electric and water service and explains the results of the investigation to the customer through multiple channels; investigates and records data relative to connected loads and rate classification; may investigate water and electric service irregularities, including facilities where illegal wiring, improper connections, or diversion of service is suspected or indicated; provides training and quality assurance; may supervise and work with, or assist in supervising, employees engaged in the field activities of the Department of Water and Power.",0,, ,2,full-time,,| Commercial Field Representative or in a class at that level working in the field turning water or electric services on and off; or| Meter Reader team leader responsible for overseeing the field activities of a group of Meter Readers., ,   ,,R, ,OPEN_INT_PROM,76368,-1,2017-04-28
499,ANIMAL CARE TECHNICIAN 4310 040116 REV 041416.txt,ANIMAL CARE TECHNICIAN,4310,2,,"  An Animal Care Technician receives and cares for all types of domestic and wild animals; assists with transferring animals to other shelters; explains regulations regarding disposition of animals to the public; works with the public to adopt animals both in the shelter and at mobile adoption events; cares for dangerous and/or diseased and injured animals; interfaces with medical staff regarding the health of animals; and cleans kennels, cages, vehicles, buildings, yards and equipment.  Animal Care Technicians must assist in humanely euthanizing animals due to disease, injury or overcrowded conditions. Animal Care Technicians require contact with the public, volunteers, adoption partners, local veterinarians/clinics, internal staff and staff in other departments; and must provide excellent customer service and animal care. An Animal Care Technician must be available for assignment to various shifts, weekends, and holidays, at any one of the animal care centers located in Central Los Angeles, South Los Angeles, West Los Angeles, San Pedro and the San Fernando Valley.",0,"university, college", animal health or animal care.,0,,,|the care or maintenance of companion animals| which must include dogs| cats| or rabbits; or,1,#Q 4 #S 3,,R, ,OPEN,47480,-1,2016-04-01
500,ACCOUNTING CLERK 1223 071318.txt,ACCOUNTING CLERK,1223,0,,"  An Accounting Clerk performs difficult and responsible clerical accounting work in the review, preparation, processing, reconciliation, and maintenance of accounting records and reports, or payroll and time keeping documents; processing and monitoring of invoice payments, and personal services contract invoice payments; may perform cashiering duties; or may act as a lead person in the performance of such work.",0,"university, college", ,2,full-time,,,1,#Q 9 #S 6,,NoR, ,OPEN_INT_PROM,60312,-1,2018-07-13
501,SENIOR STRUCTURAL ENGINEER 9425 040417 REV 042017.txt,SENIOR STRUCTURAL ENGINEER,9425,4,,"  A Senior Structural Engineer plans, organizes and directs the work of an engineering staff engaged in the preparation or checking of designs, plans, specifications, and reports for a variety of structures; performs the more difficult and responsible technical engineering work; participates in the budget process; applies sound supervisory principles and techniques in building and maintaining an effective work force; and fulfills equal employment opportunity responsibilities.",0,, ,2,full-time,,|a position at the level of Structural Engineering Associate III. , ,   ,,P, ,OPEN_INT_PROM,134936,-1,2017-04-07
502,AQUARIST 2400 050214.txt,AQUARIST,2400,2,,  An Aquarist procures and maintains a variety of live seawater animals and plant life in aquaria; and maintains the electrical and mechanical components of large seawater systems.,4,"university, college", a biological science,8,full-time,,|n aquarist in the collection and care of live seawater specimens and the maintenance of a large seawater system., ,   ,,NoR, ,OPEN,62378,-1,2014-05-02
503,WATER UTILITY WORKER 3912 120817.txt,WATER UTILITY WORKER,3912,1,ABC,"  A Water Utility Worker installs, maintains, operates, replaces, and repairs water mains, services, fire hydrants, water meters, and appurtenant valves and equipment.",0,, ,8,full-time,,|the installation| and either operation and/or maintenance of all of the following:, ,   ,,R,B,OPEN_INT_PROM,-1,75428,2017-12-08
504,PROCUREMENT ANALYST 1859 022318.txt,PROCUREMENT ANALYST,1859,2,,"  A Procurement Analyst purchases or assists in purchasing a variety of equipment, services, supplies, and materials; performs professional staff work by analyzing bids and making awards based on the lowest ultimate cost to the City; and performs related staff work in the coordination of purchasing activities; and does related work.",4,"university, college", ,2,full-time,Procurement Aide,|commodity purchasing., ,   ,,P, ,OPEN_INT_PROM,71608,-1,2018-02-23
505,FIRE PROTECTION ENGINEERING ASSOCIATE 7978 041318.txt,FIRE PROTECTION ENGINEERING ASSOCIATE,7978,2,,"  A Fire Protection Engineering Associate performs professional engineering work in the application of engineering principles to problems of safeguarding life and property against loss from fire, explosions and related hazards; applies state and local regulations to guard against hazardous material and toxic chemical releases; conducts fire and life safety reviews of building plans and field inspections for new construction projects.",4,"university, college", ,0,,,, ,   ,,P, ,OPEN,81536,-1,2018-04-13
506,HYDROGRAPHER 7263 012717.txt,HYDROGRAPHER,7263,0,,"  A Hydrographer gathers, records, and compiles hydrographic and meteorological data pertinent to municipal water supply and rights.",1,"university, college", ,2,full-time,,|hydrography or field surveying| or in one or more of the following fields: utility electronics technician| computer electronics technician| computer control systems technician| communications systems technician| or communications instrumentation technician.,1,#Q 18 #S 12,,P, ,OPEN_INT_PROM,76034,-1,2017-01-27
507,INFORMATION SYSTEMS MANAGER 1409 090117 (2).txt,INFORMATION SYSTEMS MANAGER,1409,0,,"  An Information Systems Manager plans, organizes and directs the work of employees of a major section performing information systems work; defines the scope and tasks of project activities and reviews and reports activity status to management; assists in development of budgets and intermediate and long-range plans; assists in the formulation and organization of information systems training programs; in the Department of Water and Power, manages communication liaisons with customer business/user units; applies sound supervisory principles and techniques in building and maintaining an effective work force; and fulfills equal employment opportunity responsibilities.",0,, ,2,full-time,,|a position at the level of Programmer Analyst V| Systems Programmer III| or Senior Systems Analyst II which provides experience in the analysis| design| implementation| operation or maintenance of computer based information systems| network| and computerized data and/or software., ,   ,,NoR, ,OPEN_INT_PROM,134936,40582,2017-09-01
508,TAX COMPLIANCE OFFICER 1179 111816.txt,TAX COMPLIANCE OFFICER,1179,2,,"  A Tax Compliance Officer analyzes, interprets and enforces various tax, permit and fee liabilities, including the City business, parking and transient occupancy taxes and City permit ordinances through independent field and office investigations; may supervise other Tax Compliance Officers and clerical staff by directing and coordinating the activities of a field enforcement or office enforcement section; and may assist at a public counter or the call center providing technical assistance to customers via telephone, on-line and in-person.",4,"university, college", ,2,full-time,Tax Compliance Aide,, ,   ,,P, ,OPEN_INT_PROM,68788,-1,2016-11-18
509,APPRENTICE - METAL TRADES 3789 070816.txt,APPRENTICE - METAL TRADES,3789,3,,"  An Apprentice - Metal Trades works as an apprentice in a specific metal trade, receives on-the-job training assisting a journey-level Sheet Metal Worker, Structural Steel Shop Worker, Blacksmith, Welder, or Auto Body Builder and Repairer; attends approved classroom instruction during off duty hours.  ",1,high school, ,8,full-time,,|the performance of mechanical| machining| or metal trades; or, ,   ,,R, ,OPEN_INT_PROM,72046,-1,2016-07-08
510,SENIOR ELECTRICAL REPAIR SUPERVISOR 3856 060118.txt,SENIOR ELECTRICAL REPAIR SUPERVISOR,3856,0,,  A Senior Electrical Repair Supervisor supervises and coordinates the work of several supervisors and their crews engaged in shop and field maintenance and repair of electrical equipment and auxiliaries; applies sound supervisory techniques in building and maintaining an effective workforce; and fulfills Equal Employment Opportunity responsibilities.,0,, ,2,full-time,Electrical Repair Supervisor,, ,   ,,R, ,OPEN_INT_PROM,134518,-1,2018-06-01
511,CHIEF STREET SERVICES INVESTIGATOR 4286 2017Revised 11.21.txt,CHIEF STREET SERVICES INVESTIGATOR,4286,2,,"  A Chief Street Services Investigator manages the Investigation and Enforcement Division of the Bureau of Street Services, Department of Public Works; directs or assists in directing investigations made to enforce laws and regulations pertaining to the use and the safe condition of City streets, sidewalks, and other public ways; and does related work.",0,, ,2,full-time,,| Senior Street Services Investigator| or in a class at that level| supervising employees engaged in conducting investigations and enforcing laws and regulations in a municipal code or law enforcement agency; and, ,   ,,R, ,OPEN_INT_PROM,112960,-1,2017-11-17
512,AIRPORT INFORMATION SPECIALIST 1783 121115.txt,AIRPORT INFORMATION SPECIALIST,1783,3,,"  An Airport Information Specialist provides and/or supervises the provision of information services at Los Angeles World Airports; plans, organizes and coordinates special events for the Department; and does related work.",0,, ,0,,,|n Airport Guide II; or|n Airport Guide I or Airport Information Aide., ,   ,,R, ,OPEN_INT_PROM,52930,-1,2015-12-11
513,CEMENT FINISHER 3353 030918.txt,CEMENT FINISHER,3353,3,,"  A Cement Finisher does skilled work in mixing, placing, and finishing concrete; and may be required to act as a lead for and work with a small crew.",0,apprenticeship,| cement finisher helper performing duties in mixing| placing| and finishing concrete surfaces. ,4,full-time,Cement Finisher Worker,| cement finisher helper performing duties in mixing| placing| and finishing concrete surfaces. , ,   ,,R,B,OPEN_INT_PROM,79244,85702,2018-03-09
514,CHIEF CLERK PERSONNEL 1260 042117.txt,CHIEF CLERK PERSONNEL,1260,0,,"  A Chief Clerk Personnel plans, coordinates, and supervises the work of a large group of clerical employees in the Personnel Department engaged in a wide variety of clerical activities; applies sound supervisory principles and techniques in building and maintaining an effective work force; fulfills equal employment opportunity responsibilities; independently performs clerical work of a difficult and highly responsible nature; and does related work.",0,, ,2,full-time,Personnel Records Supervisor,, ,   ,,NoR, ,OPEN_INT_PROM,80941,-1,2017-04-21
515,PRINCIPAL PROPERTY OFFICER 3210 121517.txt,PRINCIPAL PROPERTY OFFICER,3210,0,,"  A Principal Property Officer supervises a group of Senior Property Officers, Property Officers and other personnel engaged in maintaining physical custody, control, and detailed documentation of department-owned equipment and booked property.",0,, ,2,full-time,Senior Property Officer,, ,   ,,R, ,OPEN_INT_PROM,71211,-1,2017-12-15
516,SENIOR SAFETY ENGINEER ELEVATORS 4264  042718.txt,SENIOR SAFETY ENGINEER ELEVATORS,4264,0,,"  A Senior Safety Engineer Elevators assigns, reviews and evaluates the work of Safety Engineer Elevators engaged in the inspection of escalators, elevators, and similar devices for conformance to State laws and City ordinances regulating their design, installation and operation; applies sound supervisory principles and techniques in building and maintaining an effective work force; and fulfills equal employment opportunity responsibilities.",0,, ,2,full-time,Safety Engineer Elevators,, ,   ,,R, ,OPEN_INT_PROM,102677,-1,2018-04-27
517,PARK SERVICES SUPERVISOR 2426 072018.txt,PARK SERVICES SUPERVISOR,2426,0,,  A Park Services Supervisor directs the operation of City-operated commercial enterprises and the regulation of privately-operated concessions at City parks and recreational areas.,0,, ,6,full-time,,|a class at least at the level of Senior Park Services Attendant in the operation of commercial| amusement| or service facilities., ,   ,,R, ,OPEN_INT_PROM,81452,-1,2018-07-20
518,SENIOR PHOTOGRAPHER 1795 041516 REVISED 042816.txt,SENIOR PHOTOGRAPHER,1795,2,,"  A Senior Photographer assigns, reviews, and evaluates the work of Photographers engaged in taking black and white, and color still, motion picture or video photography, photographs or video tapes, and working with computers to process digital image files; may personally perform the more difficult photographic and videotape duties; applies sound supervisory principles and techniques in building and maintaining an effective work force; and fulfills equal employment opportunity responsibilities.",0,, ,5,full-time,,| Photographer or in a class which is at that level|, ,   ,,NoR, ,OPEN_INT_PROM,75052,-1,2016-04-15
519,WATER SERVICE WORKER 3931 040618 (1).txt,WATER SERVICE WORKER,3931,3,,"  A Water Service Worker inspects, repairs, rebuilds, tests, and calibrates a variety of water meters in a meter shop and in field installations; does minor maintenance work on service connections and appurtenant water service equipment; and performs routine and requested inspections of consumers' property and plumbing facilities. ",0,, ,1,full-time,Water Utility Worker,, ,   ,,R, ,OPEN_INT_PROM,72098,-1,2018-04-06
520,SENIOR HEAVY DUTY EQUIPMENT MECHANIC 3745 012017.txt,SENIOR HEAVY DUTY EQUIPMENT MECHANIC,3745,0,,"  A Senior Heavy Duty Equipment Mechanic supervises and works with a small group of employees doing journey-level work in the maintenance and repair of construction, road maintenance, marine, or firefighting equipment.",0,, ,2,full-time,,| Heavy Duty Equipment Mechanic| or in class at that level in the maintenance and repair of construction| road maintenance| marine| or firefighting vehicles., ,   ,,R,B,OPEN_INT_PROM,88865,96945,2017-01-20
521,PAINTER SUPERVISOR 3426 120514.txt,PAINTER SUPERVISOR,3426,0,,"  A Painter Supervisor assigns, reviews and evaluates the work of Senior Painters, Painters and other employees engaged in preparing surfaces, lead abatement and mixing, matching, and applying paint and related material by brush, roller or spray gun to machinery, equipment, piping systems, furniture, and the interior and exterior of buildings and other structures, and schedules and estimates painting costs; applies sound supervisory principles and techniques in building and maintaining an effective work force; and fulfills equal employment opportunity responsibilities.",0,, ,4,full-time,,| journey-level painter., ,   ,,P, ,OPEN_INT_PROM,83645,95996,2014-12-05
522,CHIEF FORENSIC CHEMIST 2237 092818.txt,CHIEF FORENSIC CHEMIST,2237,2,,"  A Chief Forensic Chemist, as the Assistant Head or Head of the Police Criminalistics laboratory, manages personnel engaged in collecting and preserving physical evidence in the investigation of crime and suspected criminals and the examination of evidence by means of physical and chemical analyses; may give expert testimony in court; and does necessary administrative duties.",0,, ,1,full-time,Supervising Criminalist,, ,   ,,R, ,OPEN_INT_PROM,130928,-1,2018-09-28
523,ASSOCIATE ZONING ADMINISTRATOR 7998 102618 REV 110818.txt,ASSOCIATE ZONING ADMINISTRATOR,7998,3,,"  Investigates, conducts hearings and makes written determinations upon applications for conditional uses, variances, division of land maps, coastal permits, Zoning Administrator Interpretations and appeals from zoning enforcement action; supervises, administers, represents and reviews the work of professional planners in making final decisions and determinations including Subdivisions, Parcel Maps, Environmental Review and the Entitlement Case Management Sections; applies sound supervisory principles and techniques in building and maintaining an effective workforce; and fulfills equal employment opportunity responsibilities.",0,"university, college", ,2,full-time,,| Senior City Planner or in a class at that level providing professional city planning or zoning administration experience; or| City Planner or in a class at that level providing professional city planning or zoning administration experience; or| City Planning Associate or in a class at that level providing professional experience in the administration or implementation of city planning or zoning., ,   ,,P, ,OPEN_INT_PROM,143957,-1,2018-10-26
524,PRINCIPAL TAX COMPLIANCE OFFICER 1195 030218.txt,PRINCIPAL TAX COMPLIANCE OFFICER ,1195,0,,"  A Principal Tax Compliance Officer plans, organizes and directs the work of professional and clerical employees assigned to various divisions within the Office of Finance involved in the administration and enforcement of tax and permit ordinances or collection of outstanding debts owed to the City; applies sound supervisory principles and techniques in building and maintaining an effective work force; and fulfills equal employment opportunity responsibilities.",0,, ,2,full-time,,|a position at the level of Tax Compliance Officer III supervising the administration and enforcement of tax and permit ordinances and/or the collection of various outstanding debts., ,   ,,R, ,OPEN_INT_PROM,-1,-1,2018-03-02
525,SAFETY ENGINEER 1727 021717.txt,SAFETY ENGINEER,1727,0,,"  A Safety Engineer develops, implements, directs, maintains, and assesses occupational safety and health programs; monitors compliance with City, departmental, and applicable State and Federal occupational safety and health standards; coordinates and/or provides occupational safety and health training; makes recommendations for safety improvements; liaisons on safety matters with line supervisors, other departments, and local or state regulatory agencies; recommends, facilitates, directs or conducts safety investigations and inspections; supervises professional and clerical personnel engaged in occupational safety and health work; applies sound supervisory principles and techniques in building and maintaining an effective work force, and fulfills equal employment opportunity responsibilities.",0,"university, college", ,4,full-time,,, ,   ,,R, ,OPEN_INT_PROM,102531,37432,2017-02-17
526,PERFORMING ARTS DIRECTOR 2449 020317 REV 020817.txt,PERFORMING ARTS DIRECTOR,2449,4,,"  The Performing Arts Director plans, organizes and directs the work of employees engaged in the production and presentation of performing arts programs and events that promote public interest; oversees the City's municipal theatres; advises on public policy issues related to performing arts; develops and implements plans to meet the City's community and cultural needs through the arts; applies sound supervisory principles and techniques in building and maintaining an effective work force; and fulfills equal employment opportunity responsibilities. ",4,"university, college", ,3,full-time,Criminalist,, ,   ,,R, ,OPEN_INT_PROM,92143,-1,2017-02-03
527,RISK MANAGEMENT AND PREVENTION PROGRAM SPECIALIST 7980 030317.txt,RISK MANAGEMENT AND PREVENTION PROGRAM SPECIALIST,7980,3,,"  A Risk Management and Prevention Program Specialist conducts Citywide technical reviews of the engineering and safety aspects of chemical manufacturing operations involving acutely hazardous materials to evaluate the adequacy of, and the need for, safety precautions to prevent the catastrophic release of toxic materials to the environment; develops and evaluates release prevention program review criteria and quantitative standards and guidelines regarding risk management program implementation consistent with federal, state, and local laws and regulations; serves as the technical advisor regarding highly hazardous materials management; and does related work.",4,"university, college", ,3,full-time,,|the development and implementation of risk management plans| accidental release prevention and process safety management in chemical process industries; or |the regulation of federal and/or state risk management and accidental release prevention programs or advanced hazardous materials management., ,   ,,R, ,OPEN,107396,-1,2017-03-03
528,SENIOR AUTOMOTIVE SUPERVISOR 3716 112015.txt,SENIOR AUTOMOTIVE SUPERVISOR,3716,0,,"  A Senior Automotive Supervisor assists in planning, organizing, directing, and coordinating the work of employees engaged in the maintenance and repair of transportation, construction, and fire equipment; and assists in developing and writing specifications, analyzing bids, and recommending the purchase of new equipment and modifications; applies sound supervisory principles and techniques in building and maintaining an effective work force; and fulfills Equal Employment Opportunity responsibilities.",0,, ,2,full-time,Automotive Supervisor,, ,   ,,R,B,OPEN_INT_PROM,103126,-1,2015-11-20
