,FILE_NAME,JOB_CLASS_TITLE,JOB_CLASS_NO,REQUIREMENT_SET_ID,REQUIREMENT_SUBSET_ID,JOB_DUTIES,EDUCATION_YEARS,SCHOOL_TYPE,EDUCATION_MAJOR,EXPERIENCE_LENGTH,FULL_TIME_PART_TIME,EXP_JOB_CLASS_TITLE,EXP_JOB_CLASS_FUNCTION,COURSE_COUNT,COURSE_LENGHT,COURSE_SUBJECT,DRIVERS_LICENSE_REQ,DRIV_LIC_TYPE,EXAM_TYPE,ENTRY_SALARY_GEN,ENTRY_SALARY_DWP,OPEN_DATE
0,SENIOR ELECTRICAL INSPECTOR 4223 042718.txt,SENIOR ELECTRICAL INSPECTOR,4223,1,,  A Senior Electrical Inspector supervises the work of employees engaged in the inspection of new and existing electrical installations and equipment to secure conformance to the City Electrical Code; personally inspects large and complicated electrical installations; may perform responsible staff functions; may supervise the inspection of the construction of electrical installations in public buildings to ensure conformance with contract plans and specifications; may witness fabrication and testing of electrical equipment at a manufacturing plant; may witness performance of operational testing equipment prior to start up; assists in training inspection employees; applies sound supervisory techniques in building and maintaining an effective workforce; and fulfills equal employment opportunity responsibilities.,0,, ,2,full-time,Electrical Inspector,, ,   ,,P, ,OPEN_INT_PROM,99858,-1,2018-04-27
1,SUPERVISING WATER SERVICE REPRESENTATIVE 1697 081318.txt,SUPERVISING WATER SERVICE REPRESENTATIVE,1697,0,,"  A Supervising Water Service Representative manages, supervises subordinate employees, or provides staff support in the making of business arrangements to furnish water services or in conducting cross-connection inspections; interprets or supervises the interpretation of Water System Rules and Rates; supervises or handles arrangements for more complex installations or handles complex cross-connection investigations with the LA County Department of Public Health; and enforces Water Services Organization policies on the protection of the City's water supply.",0,, ,2,full-time,Water Service Representative Water System City,, ,   ,,R, ,OPEN_INT_PROM,86026,-1,2018-08-03
2,GARAGE ASSISTANT 3538 012017.txt,GARAGE ASSISTANT,3538,2,,"  A Garage Assistant performs general servicing and lubricating of cars, trucks and motorcycles; chauffeuring; parking cars; washing and waxing; replaces tires on cars and trucks in the shop and in the field; assists equipment mechanics by removing and replacing defective radiators, hoses, fan belts, and batteries; may operate a light to heavy duty tow truck; may make minor repairs to vehicles; may install or remove various interior and exterior vehicle equipment; and may perform other non-skilled tasks as required.",0,, ,0,,,, ,   ,,P, ,OPEN,45132,-1,2017-01-20
3,WATER BIOLOGIST 7856 120216.txt,WATER BIOLOGIST,7856,0,,"  A Water Biologist performs oceanographic, marine biological, estuarine, limnological, stormwater, freshwater, and wetland surveys; conducts analysis of marine, estuarine, and freshwater aquatic organisms; performs toxicological tests using marine and freshwater organisms; performs biological activated sludge analysis on wastewater; assesses the impact of wastewater and stormwater discharges; identifies marine and freshwater invertebrates, fish, algae and vegetation; collects physical, chemical and biological data in water reservoirs and tanks for maintaining water quality; researches and develops new water quality equipment and processes; conducts studies; analyzes and writes reports on biological and associated data; reviews and comments on pertinent documents; confers with governmental agencies on water quality matters; represent the City at meetings and conferences; and may act as lead worker or supervisor for employees engaged in performing such tasks.",4,"university, college", ,0,,,, ,   ,,P, ,OPEN_INT_PROM,74500,82006,2016-12-02
4,DIRECTOR OF AIRPORT OPERATIONS 9304 062317 (3).txt,DIRECTOR OF AIRPORT OPERATIONS,9304,3,,"  A Director of Airport Operations plans, coordinates and directs through subordinate managers, the Los Angeles International Airport ground operations, including the use of airport facilities, law enforcement and construction and maintenance; participates in planning and coordinating modifications to airport facilities to accommodate airport tenants and passengers; and applies sound supervisory principles and techniques in building and maintaining an effective work force.",0,, ,4,full-time,Water Service Representative Water System City,, ,   ,,R, ,OPEN_INT_PROM,171862,-1,2017-06-23
5,TAX AUDITOR 1514 062218.txt,TAX AUDITOR,1514,2,,"  A Tax Auditor conducts or reviews field or office audits of accounting and related records of persons, businesses, and organizations to determine the accuracy of self-assessed tax payments to the City of Los Angeles; and performs internal audits of operations related to business tax and permit enforcement, audit, and administration.",4,"university, college", ,0,,,,following,#Q 32 #S 24,,R, ,OPEN,73090,-1,2018-06-22
6,ASSISTANT UTILITY BUYER 1860 051818.txt,ASSISTANT UTILITY BUYER,1860,2,,  An Assistant Utility Buyer assists in purchasing or purchases a variety of commodities for use in the Department of Water and Power. ,4,"university, college", ,4,full-time,,|commodity purchasing for use rather than for resale and in preparing specifications| analyzing bids| conferring with vendors| and making recommendations for awards.| buyer in commodity purchasing for use rather than for resale and preparing specifications| and making recommendations for awards may be substituted on a year-for-year basis for the education lacking in Requirement No. 2 up to a maximum of two years (one year of education is equivalent to 30 semesters or 45 quarter units).,1,#Q 45 #S 30,,P, ,OPEN,79438,-1,2018-05-18
7,SYSTEMS ANALYST 1596 102717.txt,SYSTEMS ANALYST,1596,3,ABCAB,"  A Systems Analyst analyzes procedures, methods and operations of computer-based information systems; designs, implements, and recommends information systems to improve the efficiency and economy of City operations; performs cost benefit and feasibility analyses related to the modification of existing computer-based information systems, the maintenance and support of information systems, or the implementation of new computer-based systems; accesses and analyzes information from automated files using high-level retrieval languages.",0,"university, college"," Computer Science, Information Systems, or Geographical Information Systems",4,full-time,,|a class at the level of Management Assistant which provides experience in:, ,   ,,P, ,OPEN_INT_PROM,84459,79500,2017-10-27
8,GENERAL SERVICES MANAGER  9601 042117.txt,GENERAL SERVICES MANAGER ,9601,0,,"  A General Services Manager serves as a Director or Assistant Director in a division of the Los Angeles Department of Water and Power (LADWP), overseeing the activities of construction, engineering, technical, clerical, and administrative employees engaged in the design, construction, maintenance, repair, operation, and testing of LADWP's hard infrastructure (capital assets); applies sound supervisory principles and techniques in building and maintaining an effective work force; and fulfills Equal Employment Opportunity responsibilities.",0,, ,2,full-time,Construction Maintenance Superintendent Shops Superintendent Fleet Services Manager,, ,   ,,R, ,OPEN_INT_PROM,224136,-1,2017-04-21
9,AQUATIC DIRECTOR 2419  082517 REV 0090717.txt,AQUATIC DIRECTOR ,2419,2,,"  An Aquatic Director plans, organizes, directs, and supervises the operation of a comprehensive aquatics program associated with public pools and open water facilities on a City-wide basis.  ",4,"university, college", ,2,full-time,,, ,   ,,R, ,OPEN_INT_PROM,-1,-1,2017-08-25
10,PORT POLICE SERGEANT 3222 121616.txt,PORT POLICE SERGEANT,3222,0,,"  A Port Police Sergeant supervises, assigns, reviews, and evaluates the work of a group of Port Police Officers or Port police civilian employees in the performance of their assigned duties; may perform some initial and follow-up investigations of crimes and related matters; exercises tactical command of field events; maintains Port community development programs; applies sound supervisory principles and techniques in building and maintaining an effective work force; fulfills equal employment opportunity responsibilities; and does related work. 	",0,, ,2,full-time,Port Police Officer,, ,   ,,R, ,DEPT_PROM,102740,-1,2016-12-16
11,HEATING AND REFRIGERATION INSPECTOR 4245 121115.txt,HEATING AND REFRIGERATION INSPECTOR,4245,0,,"  A Heating and Refrigeration Inspector makes inspections of heating, ventilating, air-conditioning, and refrigerating installations for conformance to pertinent laws, regulations and approved plans and specifications; may inspect sheet metal installations for conformance to specifications; and assists in training other inspectional employees as required.",0,, ,4,full-time,,|the installation or repair of mechanical equipment used for heating| air conditioning| or refrigeration purposes., ,   ,,R, ,OPEN_INT_PROM,-1,-1,2015-12-11
12,CARPET LAYER 3418 061915.txt,CARPET LAYER,3418,3,,"  A Carpet Layer installs, removes, and repairs carpeting and padding.",3,apprenticeship,| helper to a journey-level carpet layer.,4,full-time,,| helper to a journey-level carpet layer., ,   ,,R, ,OPEN,81682,-1,2015-06-19
13,ANIMAL KEEPER 4304 083118.txt,ANIMAL KEEPER,4304,2,,"  An Animal Keeper cares for exotic mammals, birds, and reptiles (including venomous varieties) at the Los Angeles Zoo; observes and reports on animal behavior and condition for illnesses, compatibility, imminent birth and other signs reflecting the animal's well-being; prepares food for animals as instructed; maintains the exhibit premises in a clean and aesthetically pleasing manner; answers questions about animals from the general public; may make educational and other presentations before groups, and on radio and television; and may provide training and supervision to volunteers and students in caring for animals.",0,"university, college", ,1,full-time,,|the care and maintenance of exotic animals with a facility similar to the Los Angeles Zoo whose core function is the exhibition of a variety of exotic animals; or, ,   ,,P, ,OPEN,56396,-1,2018-08-31
14,CHIEF OF OPERATIONS 7258 042018 REV 051318.txt,CHIEF OF OPERATIONS,7258,2,,  A Chief of Operations supervises or assists in supervising a group of employees engaged in directing the airfield activities or managing passenger and cargo terminals at a Los Angeles World Airports' facility; and applies sound supervisory principles and techniques in building and maintaining an effective work force.,0,, ,3,full-time,Airport Superintendent Operations,, ,   ,,R, ,OPEN_INT_PROM,111374,-1,2018-04-20
15,PRINCIPAL LIBRARIAN 6155 032417 REV 040417.txt,PRINCIPAL LIBRARIAN,6155,2,,"  A Principal Librarian plans, organizes, directs, and supervises the work of library personnel at regional and neighborhood branch libraries, a Central Library department, or system-wide level, including Engagement and Learning, Emerging Technologies and Collections, or in a specialized library administrative function; ensures strategic goals and objectives are accomplished; represents and advocates for the library at community events and among diverse constituencies; may represent the Library Department and speak before elected officials, potential donors, and other public and private organizations; may interact with community based organizations and support groups, other city departments, vendors and contractors; plans, implements and reviews budgetary expenditures; applies sound supervisory principles and techniques in building and maintaining an effective work force; and fulfills equal employment opportunity responsibilities.",0,"university, college", ,2,full-time,Senior Librarian,, ,   ,,P, ,OPEN_INT_PROM,101676,-1,2017-03-24
16,SENIOR ACCOUNTANT 1523 030218.txt,SENIOR ACCOUNTANT,1523,0,,"  A Senior Accountant plans, assigns, reviews and evaluates the work of a group of accountants engaged in preparing, maintaining and analyzing City financial records and reports; reviews and recommends changes to accounting procedures and systems and their related electronic information systems; conducts internal and/or external auditing work; may personally perform the more difficult or complex accounting work; routinely exercises independent judgment involving interpretation of accounting principles and procedures; may be responsible for all accounting work in a small department or for a particular phase of accounting in a larger accounting organization; and applies sound supervisory principles and techniques in building and maintaining an effective work force, and fulfills equal employment opportunity responsibilities.",0,, ,2,full-time,Accountant,, ,   ,,P, ,OPEN_INT_PROM,76963,-1,2018-03-02
17,SENIOR SAFETY ENGINEER PRESSURE VESSELS 4262 101218.txt,SENIOR SAFETY ENGINEER PRESSURE VESSELS,4262,2,,"  A Senior Safety Engineer Pressure Vessels participates in and/or assigns, reviews and evaluates the work of Safety Engineers Pressure Vessels engaged in inspecting fired and unfired pressure vessels, and appurtenances for conformance to State laws and City ordinances regulating their design, fabrication, installation and operation; applies sound supervisory principles and techniques in building and maintaining an effective work force; and fulfills equal employment opportunity responsibilities.",0,, ,2,full-time,Safety Engineer Pressure Vessels,, ,   ,,R, ,OPEN_INT_PROM,104734,34936,2018-10-12
18,COMMUNITY AFFAIRS ADVOCATE  111414.txt,COMMUNITY AFFAIRS ADVOCATE,2496,3,,"  Liaison or community relations advocate to community groups, local civic officers and elected officials to foster partnerships with a diverse range of community interest groups to resolve problems and provide equitable services; develops and manages programs to enhance the effectiveness of the department's relationship with community, industry, political, and business stakeholders, as well as potential private donors.",0,"university, college"," Urban Planning, and",6,full-time,,|community advocacy or community/public outreach concerning sustainable development or the development of educational| communication| or community programs at the local| state or national level., ,   ,,P, ,OPEN,118807,-1,2014-11-14
19,BUILDING ELECTRICAL ENGINEER 7543 071516 REV 071816.txt,BUILDING ELECTRICAL ENGINEER,7543,2,,"  A Building Electrical Engineer supervises and participates in the preparation of plans, specifications and drawings for facilities, high and low voltage electrical systems such as power distribution systems, lighting, communication, control and instrumentation systems; supervises the checking of such plans for feasibility, constructability and conformance to good engineering practices and code requirements; may supervise a unit engaged in electrical testing of electrical appliances and equipment; or may supervise a section engaged in facility construction and commissioning.",0,"university, college", ,2,full-time,Safety Engineer Pressure Vessels,| lead or supervisor of engineering professionals.  , ,   ,,R, ,OPEN_INT_PROM,114892,-1,2016-07-15
20,SENIOR WORKERS_ COMPENSATION ANALYST 1769 041417 REV 042717.txt,SENIOR WORKERS' COMPENSATION ANALYST  ,1769,2,,"  A Senior Workers' Compensation Analyst analyzes claims for workers' compensation benefits; confers with and advises concerned parties and agencies; assigns, reviews, and evaluates the work of professional employees investigating, analyzing, and providing appropriate benefits for such claims; applies sound supervisory principles and techniques in building and maintaining an effective work force.",0,, ,2,full-time,Workers Compensation Analyst Senior Claims Representative,| workers' compensation analyst or in a position at that level administering indemnity claims| investigating and adjusting workers' compensation claims., ,   ,,P, ,OPEN_INT_PROM,82570,109139,2017-04-14
21,DIVISION LIBRARIAN 6157 012717 REV 022217.txt,DIVISION LIBRARIAN,6157,2,,"  A Division Librarian plans, organizes, and directs the work of professional and support library personnel who are providing library services to the public or supporting library services in a major division of the Los Angeles Public Library; heads a major library division such as Central Library Services, Branch Library Services, Emerging Technologies and Collections, or Engagement and Learning; assists with budget and financial reporting; assists with strategic planning activities; may represent the Library Department before elected officials, municipal agencies, and other public and private organizations; applies sound supervisory and management principles and techniques in building and maintaining an effective work force; and fulfills equal employment opportunity responsibilities.",0,"university, college", ,2,full-time,Principal Librarian,, ,   ,,P, ,OPEN_INT_PROM,146150,-1,2017-01-27
22,ELECTRIC METER SETTER 3822 012017.txt,ELECTRIC METER SETTER,3822,2,,"  An entry-level Electric Meter Setter works as a trainee under close supervision assisting journey-level Electric Meter Setters in the performance of their duties. Trainees receive extensive classroom training as well as on-the-job training. A journey-level Electric Meter Setter installs, changes and removes a large variety of electric meters and metering equipment on the premises of industrial, commercial and domestic consumers, and performs related work. ",0,, ,1,full-time,,| helper in an electrical trade; or, ,   ,,P, ,OPEN_INT_PROM,72348,-1,2017-01-20
23,SENIOR STOREKEEPER 1837 052518.txt,SENIOR STOREKEEPER,1837,0,,"  A Senior Storekeeper assigns, reviews and evaluates the work of Storekeepers and other employees engaged in storekeeping activities in a district store, a construction project store, or a large independent or specialized section of a general store; directs a smaller store serving a single large City department; may act as the assistant to a Principal Storekeeper; applies sound supervisory principles and techniques in building and maintaining an effective work force, and fulfills Equal Employment Opportunity responsibilities.",0,, ,2,full-time,,| Storekeeper or in a class at least at that level supervising and working with employees engaged in storekeeping., ,   ,,P, ,OPEN_INT_PROM,64989,85702,2018-05-25
24,UNDERGROUND DISTRIBUTION CONSTRUCTION MECHANIC 3812 101918.txt,UNDERGROUND DISTRIBUTION CONSTRUCTION MECHANIC,3812,4,,"  An Underground Distribution Construction Mechanic constructs, maintains, and repairs underground ducts, maintenance holes, and vaults.",0,, ,1,full-time,Maintenance Laborer Maintenance Construction Helper Electrical Craft Helper,|maintenance and construction work involving pipeline construction| asphalt work| electrical conduit construction| or concrete and cement work or carpentry; or| Utility Pre-Craft Trainee with the Los Angeles Department of Water and Power| with: six months in the Underground Construction Mechanic trade| or working on a district crew in Power Distribution overhead and underground| or with Water Distribution| or| or concrete and cement work or carpentry while in the United States Armed Forces., ,   ,,R, ,OPEN_INT_PROM,79364,-1,2018-10-19
25,POLICE SERGEANT 2227 102116.txt,POLICE SERGEANT                                                                     ,2227,0,,"  A Police Sergeant supervises a squad or detail of Police Officers or civilian employees in the performance of their assigned duties; performs some initial and follow-up investigation of crimes; does some surveillance work to detect and prevent crime; and does related work.  REQUIREMENTS/MINIMUM QUALIFICATIONS	 1. Four years as a Police Officer and/or Police Detective in the Los Angeles Police Department (LAPD), of which two years (26 Deployment Periods) must have been in an eligible geographic field (patrol) and/or traffic assignment by July 7, 2017; and  2. Completion of 60 semester or 90 quarter units at an accredited college or university.   3. Experience as an officer of a public, non-military law enforcement agency (other than the LAPD or MTA) may be substituted at the rate of one year of such experience for six months of qualifying service, for up to a maximum of one year of the four-year requirement.   ",0,"university, college", ,0,,,, ,   ,,NoR, ,DEPT_PROM,108440,-1,2016-10-21
26,STRUCTURAL ENGINEERING ASSOCIATE 7957 061617.txt,STRUCTURAL ENGINEERING ASSOCIATE,7957,3,,"  A Structural Engineering Associate performs professional structural engineering work in the preparation or checking of designs, plans, specifications, estimates, and reports for a variety of structures; and does related work.",0,"university, college", ,0,,,, ,   ,,P, ,OPEN,80242,88468,2017-06-16
27,SENIOR CONSTRUCTION ENGINEER 7289 042514.txt,SENIOR CONSTRUCTION ENGINEER,7289,3,,  A Senior Construction Engineer directs a large group of professional engineers and technical staff engaged in managing the activities of contract construction projects; assists in administering a contract construction program for the Department of Public Works; applies sound supervisory principles and techniques in building and maintaining an effective work force; fulfills equal employment opportunity responsibilities; and acts as assistant division engineer and may act as division engineer.,0,"university, college", ,2,full-time,,| civil engineer| architect| or in a class at least at that level which provides experience in the design or construction of commercial| industrial| or public buildings| or large wastewater treatment plant facilities; or, ,   ,,P, ,OPEN_INT_PROM,122326,-1,2014-04-25
28,SOCIAL WORKER 2385 102717  revised.txt,SOCIAL WORKER,2385,0,,"  A Social Worker performs a variety of professional social work tasks involving individuals, families, groups and communities; provides information and assistance to program recipients, caregivers and other professionals providing services to clients; performs continuing client assessment, diagnosis and treatment plans for various social services programs; may assign, review and evaluate the work of a group of employees engaged in delivering social services, including applying sound supervisory principles and techniques including building and maintaining an effective work force and fulfilling equal employment opportunity responsibilities, and personally conducts clinical assessments.",4,"university, college", ,0,,,, ,   ,,P, ,DEPT_PROM,71608,-1,2017-10-27
29,CITY PLANNER 7944 120718.txt,CITY PLANNER,7944,3,,"  A City Planner plans, supervises, coordinates and reviews the work of a unit engaged in professional City planning activities such as community and citywide planning, environmental planning, airport planning, land use administration, or zoning administration; applies sound supervisory principles and techniques in building and maintaining an effective work force; and on an exceptional basis some positions may function as a project manager and may personally perform work on the more complex and large planning projects exercising a high degree of decision-making authority. A City Planner may also conduct public hearings.",4,"university, college"," urban planning, urban studies, urban design, architecture, landscape architecture, geography or a closely-related field and four years of full-time paid professional experience in long-range or current urban planning. ",2,full-time,City Planning Associate,|long-range or current urban planning. , ,   ,,P, ,OPEN_INT_PROM,107396,-1,2018-12-07
30,SENIOR CIVIL ENGINEERING DRAFTING TECHNICIAN 7207 081718.txt,SENIOR CIVIL ENGINEERING DRAFTING TECHNICIAN ,7207,0,,"  A Senior Civil Engineering Drafting Technician assigns, reviews and evaluates the work of drafting technicians engaged in the preparation and maintenance of civil and structural engineering maps, design drawings, and plans; performs and maintains project records; assists in the development, training and implementation of computer-aided drafting (CAD), geographic information systems (GIS) and drawing management systems, in compliance with drafting and design standards; manages media storage, retrieval and security of data, electronic drawings and digital photo files; performs technical subprofessional engineering work in preparing designs, plans, specifications, and estimates; prepares complex civil and structural engineering plans on CAD; provides engineering information relative to proposed work to engineers, contractors and the general public; applies sound supervisory principles and techniques in building and maintaining an effective work force; and fulfills Equal Employment Opportunity responsibilities.",0,, ,3,full-time,,|civil engineering drafting in a class which is at the level of a Civil Engineering Drafting Technician., ,   ,,P, ,OPEN_INT_PROM,71180,88354,2018-08-17
31,SENIOR TRAFFIC SUPERVISOR 3218 121517.txt,SENIOR TRAFFIC SUPERVISOR,3218,0,,"  A Senior Traffic Supervisor assigns, reviews, and evaluates the work of a group of employees engaged in traffic direction, parking control, impoundment of vehicles, traffic control at special events, and other related traffic and pedestrian safety functions; applies sound supervisory principles and techniques in building and maintaining an effective work force; and fulfills equal employment opportunity responsibilities. ",0,, ,2,full-time,Traffic Officer,, ,   ,,R, ,DEPT_PROM,63976,-1,2017-12-15
